{
  "schemaVersion": 1,
  "generatedAt": "2026-08-15T00:03:31+08:00",
  "authoritativeMarkdown": "docs/00-governance/decision-register.md",
  "decisions": [
    {
      "id": "D-001",
      "title": "竞品全部功能的验收口径",
      "status": "ACCEPTED",
      "acceptedOn": "2026-07-31",
      "choiceKey": "public-only",
      "choice": "仅以公开可验证资料为准",
      "source": "Owner decision response dated 2026-07-31",
      "supersedes": null
    },
    {
      "id": "D-002",
      "title": "离线食物与条码数据策略",
      "status": "ACCEPTED",
      "acceptedOn": "2026-07-31",
      "choiceKey": "licensed-core",
      "choice": "台湾食药署 + USDA Foundation/SR + 用户自建",
      "source": "Owner decision response dated 2026-07-31",
      "supersedes": null
    },
    {
      "id": "D-003",
      "title": "AI API 契约与凭据归属",
      "status": "ACCEPTED",
      "acceptedOn": "2026-07-31",
      "choiceKey": "per-user-openai",
      "choice": "每人配置 OpenAI-compatible Base URL、model 和 key",
      "source": "Owner decision response dated 2026-07-31",
      "supersedes": null
    },
    {
      "id": "D-004",
      "title": "Base URL 安全范围",
      "status": "ACCEPTED",
      "acceptedOn": "2026-07-31",
      "choiceKey": "https-only",
      "choice": "仅允许 HTTPS",
      "source": "Owner decision response dated 2026-07-31",
      "supersedes": null
    },
    {
      "id": "D-005",
      "title": "React Native 工程形态",
      "status": "ACCEPTED",
      "acceptedOn": "2026-07-31",
      "choiceKey": "expo-dev-build",
      "choice": "Expo development build + prebuild，并检入 ios/",
      "source": "Owner decision response dated 2026-07-31",
      "supersedes": null
    },
    {
      "id": "D-006",
      "title": "本地数据与备份边界",
      "status": "ACCEPTED",
      "acceptedOn": "2026-07-31",
      "choiceKey": "manual-encrypted",
      "choice": "SQLite + 手动加密导出/导入，默认排除 iCloud",
      "source": "Owner decision response dated 2026-07-31",
      "supersedes": null
    },
    {
      "id": "D-007",
      "title": "HealthKit 与系统健康数据",
      "status": "ACCEPTED",
      "acceptedOn": "2026-07-31",
      "choiceKey": "phase-two",
      "choice": "首版本地记录，第二阶段再决定 HealthKit",
      "source": "Owner decision response dated 2026-07-31",
      "supersedes": null
    },
    {
      "id": "D-008",
      "title": "给朋友的 iOS 分发方式",
      "status": "ACCEPTED",
      "acceptedOn": "2026-07-31",
      "choiceKey": "testflight-then-decide",
      "choice": "开发期 TestFlight，稳定后再选长期渠道",
      "source": "Owner decision response dated 2026-07-31",
      "supersedes": null
    },
    {
      "id": "D-009",
      "title": "项目工作台运行形态",
      "status": "ACCEPTED",
      "acceptedOn": "2026-07-31",
      "choiceKey": "local-live-snapshots",
      "choice": "本地事件流实时工作台 + 静态快照",
      "source": "Owner decision response dated 2026-07-31",
      "supersedes": null
    },
    {
      "id": "D-010",
      "title": "项目推进节奏",
      "status": "ACCEPTED",
      "acceptedOn": "2026-07-31",
      "choiceKey": "map-then-increments",
      "choice": "先完成完整功能地图，再小批确认与实现",
      "source": "Owner decision response dated 2026-07-31",
      "supersedes": null
    },
    {
      "id": "D-011",
      "title": "Nuttie 的 iOS 最低版本",
      "status": "ACCEPTED",
      "acceptedOn": "2026-07-31",
      "choiceKey": "ios-17",
      "choice": "iOS 17+",
      "source": "Owner decision response dated 2026-07-31",
      "supersedes": null
    },
    {
      "id": "D-012",
      "title": "离线食品数据包更新方式",
      "status": "ACCEPTED",
      "acceptedOn": "2026-07-31",
      "choiceKey": "release-and-signed-import",
      "choice": "随 App 发版 + Files 签名包导入",
      "source": "Owner decision response dated 2026-07-31",
      "supersedes": null
    },
    {
      "id": "D-013",
      "title": "首版营养字段范围",
      "status": "ACCEPTED",
      "acceptedOn": "2026-07-31",
      "choiceKey": "macro-plus-label",
      "choice": "能量、蛋白质、碳水、脂肪、纤维、糖、钠",
      "source": "Owner decision response dated 2026-07-31",
      "supersedes": null
    },
    {
      "id": "D-014",
      "title": "营养标签照片发送给 AI",
      "status": "ACCEPTED",
      "acceptedOn": "2026-07-31",
      "choiceKey": "per-use-preview",
      "choice": "首次说明 + 每次预览并确认发送",
      "source": "Owner decision response dated 2026-07-31",
      "supersedes": null
    },
    {
      "id": "D-015",
      "title": "本地数据库加密等级",
      "status": "ACCEPTED",
      "acceptedOn": "2026-07-31",
      "choiceKey": "sqlcipher",
      "choice": "SQLCipher + Keychain 数据库密钥",
      "source": "Owner decision response dated 2026-07-31",
      "supersedes": null
    },
    {
      "id": "D-016",
      "title": "首发语言范围",
      "status": "ACCEPTED",
      "acceptedOn": "2026-07-31",
      "choiceKey": "zh-hans",
      "choice": "仅简体中文",
      "source": "Owner decision response dated 2026-07-31",
      "supersedes": null
    },
    {
      "id": "D-017",
      "title": "功能对标交付方式",
      "status": "ACCEPTED",
      "acceptedOn": "2026-07-31",
      "choiceKey": "full-map-phased",
      "choice": "完整对标范围不删减，分阶段交付",
      "source": "Owner decision response dated 2026-07-31",
      "supersedes": null
    },
    {
      "id": "D-018",
      "title": "导航实现",
      "status": "ACCEPTED",
      "acceptedOn": "2026-08-14",
      "choiceKey": "expo-router",
      "choice": "Expo Router；不依赖 beta typed routes；深链参数运行时校验",
      "source": "Owner batch readback confirmation via request_user_input, 2026-08-14",
      "supersedes": null
    },
    {
      "id": "D-019",
      "title": "UI 状态管理",
      "status": "ACCEPTED",
      "acceptedOn": "2026-08-14",
      "choiceKey": "zustand-ui-only",
      "choice": "Zustand 仅管理 UI、session 与草稿；SQLite 为领域唯一真源",
      "source": "Owner batch readback confirmation via request_user_input, 2026-08-14",
      "supersedes": null
    },
    {
      "id": "D-020",
      "title": "SQLite 访问层",
      "status": "ACCEPTED",
      "acceptedOn": "2026-08-14",
      "choiceKey": "drizzle-controlled-sql",
      "choice": "Drizzle 管理常规 schema/query，关键路径保留受控 SQL",
      "source": "Owner batch readback confirmation via request_user_input, 2026-08-14",
      "supersedes": null
    },
    {
      "id": "D-021",
      "title": "表单与运行时校验",
      "status": "ACCEPTED",
      "acceptedOn": "2026-08-14",
      "choiceKey": "react-hook-form-zod",
      "choice": "React Hook Form + Zod；领域不变量独立",
      "source": "Owner batch readback confirmation via request_user_input, 2026-08-14",
      "supersedes": null
    },
    {
      "id": "D-023",
      "title": "单元与组件测试",
      "status": "ACCEPTED",
      "acceptedOn": "2026-08-14",
      "choiceKey": "jest-single-runner",
      "choice": "jest-expo + Jest + React Native Testing Library 单 runner",
      "source": "Owner batch readback confirmation via request_user_input, 2026-08-14",
      "supersedes": null
    },
    {
      "id": "D-024",
      "title": "E2E 与原生测试",
      "status": "ACCEPTED",
      "acceptedOn": "2026-08-14",
      "choiceKey": "local-maestro-xctest",
      "choice": "本地 Maestro + XCTest/XCUITest；不启用云测试",
      "source": "Owner batch readback confirmation via request_user_input, 2026-08-14",
      "supersedes": null
    },
    {
      "id": "D-025",
      "title": "样式与设计 Token",
      "status": "ACCEPTED",
      "acceptedOn": "2026-08-14",
      "choiceKey": "stylesheet-semantic-tokens",
      "choice": "React Native StyleSheet + TypeScript semantic tokens + 可访问组件层",
      "source": "Owner batch readback confirmation via request_user_input, 2026-08-14",
      "supersedes": null
    },
    {
      "id": "D-032",
      "title": "Expo/RN/Node/Xcode 版本矩阵",
      "status": "CANDIDATE",
      "acceptedOn": null,
      "choiceKey": "sdk-57-spike-authorized",
      "choice": "CANDIDATE + SPIKE_AUTHORIZED：允许在约定隔离目录验证 Expo SDK 57 / RN 0.86.2；仍需第二次 Owner 动作冻结最终矩阵",
      "source": "Owner batch readback confirmation via request_user_input, 2026-08-14; formal root project not authorized",
      "supersedes": null
    },
    {
      "id": "D-037",
      "title": "包管理器",
      "status": "ACCEPTED",
      "acceptedOn": "2026-08-14",
      "choiceKey": "pnpm-11-hoisted",
      "choice": "pnpm 11.18.0 + node-linker=hoisted + pnpm-lock.yaml + frozen install",
      "source": "Owner batch readback confirmation via request_user_input, 2026-08-14",
      "supersedes": null
    },
    {
      "id": "D-038",
      "title": "产品导航外壳",
      "status": "ACCEPTED",
      "acceptedOn": "2026-08-14",
      "choiceKey": "four-destinations-contextual-add",
      "choice": "日记、趋势、食品资料、设置四个稳定入口 + 情境新增",
      "source": "Owner batch readback confirmation via request_user_input, 2026-08-14; UXD-01 alias",
      "supersedes": null
    },
    {
      "id": "D-039",
      "title": "添加餐食首层体验",
      "status": "ACCEPTED",
      "acceptedOn": "2026-08-15",
      "choiceKey": "local-search-recent-first",
      "choice": "本地搜索和最近使用优先；扫描与 AI 作为并列辅助入口",
      "source": "Owner explicit text reply after frozen D-039 prototype preview, 2026-08-15; UXD-02 alias",
      "supersedes": null
    },
    {
      "id": "D-047",
      "title": "Apple 分发身份",
      "status": "ACCEPTED",
      "acceptedOn": "2026-08-14",
      "choiceKey": "no-developer-program-self-use",
      "choice": "当前暂不加入 Apple Developer Program；只开发和安装给 Owner 自己使用",
      "source": "Owner batch readback confirmation via request_user_input, 2026-08-14; latest clarification supersedes the initial A response; REL-DEC-B alias",
      "supersedes": null
    },
    {
      "id": "D-048",
      "title": "设备与方向 profile",
      "status": "ACCEPTED",
      "acceptedOn": "2026-08-14",
      "choiceKey": "iphone-portrait",
      "choice": "iPhone 竖屏；supportsTablet=false；关闭 Mac/Vision compatibility availability",
      "source": "Owner batch readback confirmation via request_user_input, 2026-08-14; REL-DEC-C alias",
      "supersedes": null
    },
    {
      "id": "D-052",
      "title": "USDA 数据面向美国境外朋友的再分发口径",
      "status": "CANDIDATE",
      "acceptedOn": null,
      "choiceKey": "pending-owner-choice",